STRING OPERATIONS:

Microsoft Windows [Version 10.0.19045.6093]
(c) Microsoft Corporation. All rights reserved.

C:\Program Files\MySQL\MySQL Server 9.3\bin>mysql -h localhost -u root -p
Enter password: ****
ERROR 1045 (28000): Access denied for user 'root'@'localhost' (using password: YES)

C:\Program Files\MySQL\MySQL Server 9.3\bin>mysql -h localhost -u root -p
Enter password: ****
Welcome to the MySQL monitor.  Commands end with ; or \g.
Your MySQL connection id is 13
Server version: 9.3.0 MySQL Community Server - GPL

Copyright (c) 2000, 2025, Oracle and/or its affiliates.

Oracle is a registered trademark of Oracle Corporation and/or its
affiliates. Other names may be trademarks of their respective
owners.

Type 'help;' or '\h' for help. Type '\c' to clear the current input statement.

mysql> create database mytb;
Query OK, 1 row affected (0.119 sec)

mysql> use mytb;
Database changed
mysql> CREATE TABLE demo_table (    id INT PRIMARY KEY,    name VARCHAR(100),    status VARCHAR(20));
Query OK, 0 rows affected (0.285 sec)

mysql> INSERT INTO demo_table (id, name, status) VALUES (1, 'Alice', 'pass');
Query OK, 1 row affected (0.094 sec)

mysql> INSERT INTO demo_table (id, name, status) VALUES (2, 'Bob', 'fail');
Query OK, 1 row affected (0.095 sec)

mysql> desc demo_table;
+--------+--------------+------+-----+---------+-------+
| Field  | Type         | Null | Key | Default | Extra |
+--------+--------------+------+-----+---------+-------+
| id     | int          | NO   | PRI | NULL    |       |
| name   | varchar(100) | YES  |     | NULL    |       |
| status | varchar(20)  | YES  |     | NULL    |       |
+--------+--------------+------+-----+---------+-------+
3 rows in set (0.016 sec)

mysql> select *from demo_table;
+----+-------+--------+
| id | name  | status |
+----+-------+--------+
|  1 | Alice | pass   |
|  2 | Bob   | fail   |
+----+-------+--------+
2 rows in set (0.005 sec)

mysql> SELECT id, name FROM demo_table WHERE status = 'pass';
+----+-------+
| id | name  |
+----+-------+
|  1 | Alice |
+----+-------+
1 row in set (0.004 sec)

mysql> CREATE VIEW demoview1 ASSELECT id, name, status FROM demo_table WHERE status = 'pass';
ERROR 1064 (42000): You have an error in your SQL syntax; check the manual that corresponds to your MySQL server version for the right syntax to use near 'ASSELECT id, name, status FROM demo_table WHERE status = 'pass'' at line 1
mysql> CREATE VIEW demoview1 AS SELECT id, name, status FROM demo_table WHERE status = 'pass';
Query OK, 0 rows affected (0.057 sec)

mysql> SELECT CONCAT(name, ' is ', status) FROM demo_table;
+------------------------------+
| CONCAT(name, ' is ', status) |
+------------------------------+
| Alice is pass                |
| Bob is fail                  |
+------------------------------+
2 rows in set (0.058 sec)

mysql> SELECT LPAD('123', 5, '0');
+---------------------+
| LPAD('123', 5, '0') |
+---------------------+
| 00123               |
+---------------------+
1 row in set (0.003 sec)

mysql> SELECT REPLACE(name, 'A', 'X') FROM demo_table;
+-------------------------+
| REPLACE(name, 'A', 'X') |
+-------------------------+
| Xlice                   |
| Bob                     |
+-------------------------+
2 rows in set (0.004 sec)

mysql> SELECT FIND_IN_SET('pass', 'fail,pass,hold');
+---------------------------------------+
| FIND_IN_SET('pass', 'fail,pass,hold') |
+---------------------------------------+
|                                     2 |
+---------------------------------------+
1 row in set (0.058 sec)

mysql> UPDATE demo_table SET status = 'pass' WHERE id = 2;
Query OK, 1 row affected (0.092 sec)
Rows matched: 1  Changed: 1  Warnings: 0

mysql> select * from demo_table;
+----+-------+--------+
| id | name  | status |
+----+-------+--------+
|  1 | Alice | pass   |
|  2 | Bob   | pass   |
+----+-------+--------+
2 rows in set (0.004 sec)

mysql> DELETE FROM demo_table WHERE id = 2;
Query OK, 1 row affected (0.092 sec)

mysql>  select * from demo_table;
+----+-------+--------+
| id | name  | status |
+----+-------+--------+
|  1 | Alice | pass   |
+----+-------+--------+
1 row in set (0.004 sec)

mysql> SELECT * FROM demo_table WHERE status = 'pass' ORDER BY id DESC LIMIT 5;
+----+-------+--------+
| id | name  | status |
+----+-------+--------+
|  1 | Alice | pass   |
+----+-------+--------+
1 row in set (0.005 sec)


DATE OPERATION:-
mysql> SELECT CURRENT_DATE() AS today;
+------------+
| today |
+------------+
| 2025-07-29 |
+------------+
1 row in set (0.00 sec)
mysql> SELECT NOW() AS current_datetime;
+---------------------+
| current_datetime |
+---------------------+
| 2025-07-29 12:42:38 |
+---------------------+
1 row in set (0.00 sec)
mysql> SELECT CURDATE() AS today_date, CURTIME() AS now_time;
+------------+----------+
| today_date | now_time |
+------------+----------+
| 2025-07-29 | 12:43:44 |
+------------+----------+
1 row in set (0.00 sec)
mysql> SELECT DATE(NOW()) AS only_date;
+------------+
| only_date |
+------------+
| 2025-07-29 |
+------------+
1 row in set (0.00 sec)
mysql> SELECT LAST_DAY(CURDATE()) AS last_day_of_month;
+-------------------+
| last_day_of_month |
+-------------------+
| 2025-07-31 |
+-------------------+
1 row in set (0.00 sec)
mysql> SELECT WEEKDAY('2025-07-29') AS weekday_number;
+----------------+
| weekday_number |
+----------------+
| 1 |
+----------------+
1 row in set (0.00 sec)
mysql> SELECT STR_TO_DATE('29-07-2025', '%d-%m-%Y') AS formatted_date;
+----------------+
| formatted_date |
+----------------+
| 2025-07-29 |
+----------------+
1 row in set (0.00 sec)